{
  "$schema": "https://json-schema.org/draft/2020-12/schema",
  "title": "Axis texts of one locale",
  "type": "object",
  "additionalProperties": false,
  "required": ["id", "kind", "name", "formatVersion", "locale", "texts"],
  "properties": {
    "id": { "$ref": "#/$defs/id" },
    "kind": { "const": "text" },
    "name": { "$ref": "#/$defs/name" },
    "formatVersion": { "const": 1 },
    "locale": {
      "type": "string",
      "pattern": "^[A-Za-z]{2,3}(-[A-Za-z0-9]{2,8})*$"
    },
    "texts": {
      "type": "object",
      "additionalProperties": { "type": "string" }
    }
  },
  "$defs": {
    "id": {
      "type": "string",
      "format": "uuid",
      "pattern": "^[0-9a-fA-F]{8}-[0-9a-fA-F]{4}-[0-9a-fA-F]{4}-[0-9a-fA-F]{4}-[0-9a-fA-F]{12}$"
    },
    "name": {
      "type": "string",
      "pattern": "^[A-Za-z][A-Za-z0-9]*$",
      "maxLength": 60
    }
  }
}
