{
  "id": "5e1d7a20-8c4b-4f3e-9b2a-3d6c1e0f4a08",
  "kind": "text",
  "name": "TextsEn",
  "formatVersion": 1,
  "locale": "en",
  "texts": {
    "site.title": "Records",
    "nav.items": "Items",
    "nav.departments": "Departments",
    "items.title": "Items",
    "itemsByDepartment.title": "Items by department",
    "itemStatuses.title": "Item statuses",
    "itemLinks.title": "Item links",
    "itemsInDepartment.title": "Items in a department",
    "itemLinks.sameDepartment": "Same department",
    "itemLinks.open": "Open",
    "itemForm.title": "Item",
    "items.open": "Open",
    "items.delete": "Delete",
    "items.new": "New",
    "itemSections.main": "Main",
    "itemSections.pricing": "Pricing",
    "itemSections.stepMain": "Main step",
    "itemSections.stepPricing": "Pricing step",
    "reminderEntry.main": "Reminder",
    "itemRequirements.main": "Requirements main",
    "itemRequirements.dates": "Requirements dates",
    "itemKpi.title": "Item totals",
    "itemKpi.items": "Items",
    "itemKpi.priceSum": "Total price",
    "itemKpi.showDepartments": "Show departments",
    "itemKpiOverview.title": "Items and totals",
    "itemDepartmentKpi.title": "Item totals in a department",
    "itemDepartmentKpi.items": "Items in the department",
    "itemChart.title": "Items by department",
    "itemChart.items": "Items",
    "itemChart.quantitySum": "Quantity",
    "itemChartOverview.title": "Items and chart",
    "orderDetail.title": "Order detail",
    "orderSummary.main": "Summary",
    "orderSummary.lines": "Lines",
    "departments.title": "Departments",
    "myTasks.title": "My tasks",
    "item.department": "Department",
    "item.quantityPositive": "Quantity must be greater than zero.",
    "item.priceNotNegative": "Price must not be negative.",
    "item.closedInactive": "A closed item cannot be active.",
    "item.status.open": "Open",
    "item.status.closed": "Closed",
    "itemPart.noLeadingSpace": "A part name must not start with a space.",
    "order.needsLine": "An order needs at least one line.",
    "ticket.priorityPositive": "Priority must be greater than zero.",
    "ticket.dueInPast": "The due time must be in the future.",
    "role.employee": "Employee",
    "role.reader": "Reader",
    "role.filtered": "Filtered",
    "role.fielded": "Fielded",
    "role.dsonly": "Data source only",
    "role.falseOnly": "False only",
    "role.failing": "Failing",
    "role.exporter": "Exporter"
  }
}
