{
  "id": "8cfeaa2f-bc01-4cef-84a2-b91ca7211b3f",
  "kind": "text",
  "name": "TextsVi",
  "formatVersion": 1,
  "locale": "vi",
  "texts": {
    "site.title": "Nghỉ phép",
    "nav.myLeaveRequests": "Đơn nghỉ phép của tôi",
    "nav.myTasks": "Nhiệm vụ của tôi",
    "pages.myLeaveRequests.title": "Đơn nghỉ phép của tôi",
    "pages.leaveRequestForm.title": "Đơn nghỉ phép",
    "pages.myTasks.title": "Nhiệm vụ của tôi",
    "leaveRequest.label": "Đơn nghỉ phép",
    "leaveRequest.number": "Số đơn",
    "leaveRequest.employee": "Nhân viên",
    "leaveRequest.department": "Phòng ban",
    "leaveRequest.leaveType": "Loại nghỉ phép",
    "leaveRequest.firstDay": "Ngày đầu",
    "leaveRequest.lastDay": "Ngày cuối",
    "leaveRequest.days": "Số ngày",
    "leaveRequest.reason": "Lý do",
    "leaveRequest.status": "Trạng thái",
    "leaveRequest.decisionComment": "Ý kiến phê duyệt",
    "leaveRequest.submit": "Gửi duyệt",
    "leaveRequest.cannotSubmit": "Chỉ có thể gửi đơn nháp hoặc bị trả lại có ngày cuối không trước ngày đầu.",
    "leaveRequest.managerApproval": "Trưởng phòng duyệt",
    "leaveRequest.sections.request": "Đơn",
    "leaveRequest.sections.decision": "Quyết định",
    "task.approve": "Duyệt",
    "task.return": "Trả lại",
    "task.reject": "Từ chối",
    "role.employee": "Nhân viên",
    "role.departmentManager": "Trưởng phòng"
  }
}
