{
  "id": "3bdbd9fa-77b1-4855-b3fe-de5d0a0146b2",
  "kind": "text",
  "name": "TextsVi",
  "formatVersion": 1,
  "locale": "vi",
  "texts": {
    "application.title": "Quản lý tài sản",
    "application.description": "Theo dõi tài sản của công ty, người đang giữ và việc bảo trì.",
    "site.title": "Quản lý tài sản",
    "site.description": "Đăng ký tài sản và xem tài sản ở đâu, ai đang giữ.",
    "nav.assets": "Tài sản",
    "nav.dashboard": "Tổng quan",
    "pages.assets.title": "Tài sản",
    "pages.assetForm.title": "Tài sản",
    "pages.assetDetail.title": "Chi tiết tài sản",
    "pages.dashboard.title": "Tổng quan",
    "dashboard.warranties.label": "Bảo hành hết hạn trong 30 ngày",
    "dashboard.byStatus.title": "Tài sản theo trạng thái",
    "dashboard.byStatus.count": "Tài sản",
    "actions.open": "Mở",
    "actions.new": "Thêm mới",
    "actions.view": "Xem",
    "asset.label": "Tài sản",
    "asset.number": "Số",
    "asset.name": "Tên",
    "asset.category": "Loại",
    "asset.status": "Trạng thái",
    "asset.location": "Địa điểm",
    "asset.holder": "Người giữ",
    "asset.currency": "Tiền tệ",
    "asset.purchaseCost": "Giá mua",
    "asset.purchaseDate": "Ngày mua",
    "asset.warrantyEnd": "Hết hạn bảo hành",
    "asset.warrantyEnd.help": "Ngày hết hạn bảo hành của nhà cung cấp. Bảng điều khiển báo sắp hết hạn trước 30 ngày.",
    "asset.attachments": "Tệp đính kèm",
    "asset.maintenance": "Bảo trì",
    "asset.software": "Phần mềm",
    "asset.status.in-stock": "Trong kho",
    "asset.status.assigned": "Đã giao",
    "asset.status.in-repair": "Đang sửa",
    "asset.status.retired": "Đã thanh lý",
    "asset.sections.general": "Chung",
    "asset.sections.purchase": "Mua sắm",
    "asset.sections.software": "Phần mềm",
    "asset.sections.attachments": "Tệp đính kèm",
    "asset.sections.maintenance": "Bảo trì",
    "asset.warrantyReminder.subject": "Sắp hết bảo hành: {name}",
    "asset.warrantyReminder.body": "Bảo hành của {name} hết hạn vào ngày {warrantyEnd}.",
    "attachment.label": "Tệp đính kèm",
    "attachment.file": "Tệp",
    "attachment.note": "Ghi chú",
    "maintenance.label": "Lần bảo trì",
    "maintenance.date": "Ngày",
    "maintenance.vendor": "Nhà cung cấp",
    "maintenance.currency": "Tiền tệ",
    "maintenance.cost": "Chi phí",
    "maintenance.note": "Ghi chú",
    "category.label": "Loại",
    "category.name": "Tên",
    "location.label": "Địa điểm",
    "location.name": "Tên",
    "vendor.label": "Nhà cung cấp",
    "vendor.name": "Tên",
    "software.label": "Phần mềm",
    "software.name": "Tên",
    "role.assetManager": "Quản lý tài sản",
    "role.employee": "Nhân viên",
    "role.auditor": "Kiểm toán viên"
  }
}
