{
  "id": "05298509-1d5c-40d1-96ab-21909ec74972",
  "kind": "text",
  "name": "TextsVi",
  "formatVersion": 1,
  "locale": "vi",
  "texts": {
    "application.title": "Yêu cầu mua hàng",
    "application.description": "Tạo yêu cầu mua hàng và đưa chúng qua các bước duyệt.",
    "site.title": "Mua hàng",
    "nav.purchaseRequests": "Yêu cầu mua hàng",
    "nav.myTasks": "Nhiệm vụ của tôi",
    "nav.requestsByDepartment": "Theo phòng ban",
    "nav.departments": "Phòng ban",
    "nav.suppliers": "Nhà cung cấp",
    "nav.approvals": "Theo dõi phê duyệt",
    "pages.purchaseRequests.title": "Yêu cầu mua hàng",
    "pages.purchaseRequestForm.title": "Yêu cầu mua hàng",
    "pages.requestsByDepartment.title": "Tổng yêu cầu mua hàng theo phòng ban",
    "pages.departments.title": "Phòng ban",
    "pages.suppliers.title": "Nhà cung cấp",
    "pages.myTasks.title": "Nhiệm vụ của tôi",
    "pages.approvals.title": "Theo dõi quy trình phê duyệt",
    "actions.open": "Mở",
    "actions.new": "Tạo mới",
    "department.label": "Phòng ban",
    "department.code": "Mã",
    "department.name": "Tên",
    "department.manager": "Trưởng phòng",
    "supplier.label": "Nhà cung cấp",
    "supplier.code": "Mã",
    "supplier.name": "Tên",
    "purchaseRequest.label": "Yêu cầu mua hàng",
    "purchaseRequest.number": "Số yêu cầu",
    "purchaseRequest.title": "Tiêu đề",
    "purchaseRequest.requester": "Người yêu cầu",
    "purchaseRequest.department": "Phòng ban",
    "purchaseRequest.supplier": "Nhà cung cấp",
    "purchaseRequest.currency": "Tiền tệ",
    "purchaseRequest.lineItems": "Dòng hàng",
    "purchaseRequest.totalAmount": "Tổng tiền",
    "purchaseRequest.status": "Trạng thái",
    "purchaseRequest.submittedAt": "Gửi lúc",
    "purchaseRequest.decisionComments": "Ý kiến phê duyệt",
    "purchaseRequest.purchaseOrderNumber": "Số đơn đặt hàng",
    "purchaseRequest.paymentReference": "Mã tham chiếu thanh toán",
    "purchaseRequest.totalAmountPositive": "Tổng tiền phải lớn hơn không.",
    "purchaseRequest.submit": "Gửi duyệt",
    "purchaseRequest.cannotSubmit": "Chỉ có thể gửi yêu cầu nháp hoặc bị trả lại có tổng tiền.",
    "purchaseRequest.managerApproval": "Trưởng phòng duyệt",
    "purchaseRequest.financeApproval": "Tài chính duyệt",
    "purchaseRequest.sections.request": "Yêu cầu",
    "purchaseRequest.sections.decision": "Quyết định",
    "lineItem.label": "Dòng hàng",
    "lineItem.description": "Mô tả",
    "lineItem.quantity": "Số lượng",
    "lineItem.unitPrice": "Đơn giá",
    "lineItem.amount": "Thành tiền",
    "lineItem.quantityPositive": "Số lượng phải lớn hơn không.",
    "lineItem.unitPriceNotNegative": "Đơn giá không được âm.",
    "task.approve": "Duyệt",
    "task.return": "Trả lại",
    "task.reject": "Từ chối",
    "role.employee": "Nhân viên",
    "role.departmentManager": "Trưởng phòng",
    "role.financeReviewer": "Người duyệt tài chính",
    "role.operator": "Người vận hành",
    "role.purchasingSystem": "Hệ thống mua hàng"
  }
}
